{
  "$schema": "https://json-schema.org/draft/2020-12/schema",
  "$id": "https://labdrian.ai/schemas/pre-sdd-entry-contract/2.1.0",
  "title": "Pre-SDD Entry Contract v2",
  "description": "Closed, versioned handoff from inception-pipeline to the native SDD dispatcher. Artifact references identify persisted records without embedding their content. This document validates the UNION of every supported version's vocabulary: a property or enum member added by a later bundle is legal in an instance declaring an earlier supported version, and contract_version records which bundle produced the contract rather than gating which vocabulary applies. Per-version feature gating is deliberately NOT enforced here. This schema contains no conditional keywords (no if/then/else, allOf, anyOf, oneOf, or dependentRequired) by design, so a reader can determine a property's legality from one place; every version-sensitive and cross-field invariant lives in the deterministic validator at tools/entry-contract-validator instead.",
  "type": "object",
  "additionalProperties": false,
  "required": [
    "contract_version",
    "change_name",
    "project",
    "tier",
    "interaction_mode",
    "artifact_store_mode",
    "artifact_refs",
    "estimate",
    "requested_pr_strategy",
    "delivery_strategy",
    "chaining_required",
    "chain_strategy",
    "review_budget",
    "strict_tdd",
    "review_slices",
    "expected_native_next_recommendation"
  ],
  "properties": {
    "contract_version": {
      "type": "string",
      "enum": ["2.0.0", "2.1.0"],
      "description": "The bundle version that produced this contract. The set lists every version the current bundle still accepts, newest last; the newest member must equal the inception-pipeline, shared authority, schemas, and deterministic validator bundle version. Adding a member is how a backwards-compatible extension ships without invalidating contracts written by an earlier bundle."
    },
    "change_name": {
      "type": "string",
      "pattern": "^[a-z0-9]+(?:-[a-z0-9]+)*$",
      "description": "Stable kebab-case slug derived once by requirements-from-transcripts."
    },
    "project": {
      "type": "string",
      "minLength": 1,
      "description": "Stable project identifier used in artifact references."
    },
    "tier": {
      "type": "integer",
      "enum": [1, 2, 3],
      "description": "Evidence-selected inception tier."
    },
    "interaction_mode": {
      "type": "string",
      "enum": ["interactive", "auto"],
      "description": "Whether required human decisions may be requested interactively or must use already-authorized defaults."
    },
    "artifact_store_mode": {
      "type": "string",
      "enum": ["engram", "openspec", "hybrid", "none"],
      "description": "Persistence mode selected for this change. OpenSpec paths are truthful references only, never synthetic placeholders."
    },
    "artifact_refs": {
      "type": "object",
      "additionalProperties": false,
      "required": [
        "entry",
        "requirements",
        "manifest",
        "architecture",
        "roadmap",
        "estimate",
        "sdd_init",
        "pipeline_state",
        "delivery"
      ],
      "properties": {
        "entry": { "$ref": "#/$defs/artifact_ref" },
        "requirements": { "$ref": "#/$defs/artifact_ref" },
        "manifest": {
          "type": "object",
          "additionalProperties": false,
          "required": ["context", "mission", "rules"],
          "properties": {
            "context": { "$ref": "#/$defs/artifact_ref" },
            "mission": { "$ref": "#/$defs/artifact_ref" },
            "rules": { "$ref": "#/$defs/artifact_ref" }
          }
        },
        "architecture": { "$ref": "#/$defs/artifact_ref" },
        "roadmap": { "$ref": "#/$defs/artifact_ref" },
        "estimate": { "$ref": "#/$defs/artifact_ref" },
        "sdd_init": { "$ref": "#/$defs/artifact_ref" },
        "pipeline_state": { "$ref": "#/$defs/artifact_ref" },
        "delivery": { "$ref": "#/$defs/artifact_ref" }
      }
    },
    "estimate": {
      "type": "object",
      "additionalProperties": false,
      "required": [
        "planned_range_hours",
        "complexity",
        "confidence",
        "human_review_included"
      ],
      "properties": {
        "planned_range_hours": { "$ref": "#/$defs/nonnegative_number_range" },
        "complexity": {
          "type": "string",
          "enum": ["low", "medium", "high", "very-high", "critical"],
          "description": "Normalized lowercase estimate complexity; for example, Critical becomes critical."
        },
        "confidence": {
          "type": "string",
          "enum": ["low", "medium", "high"]
        },
        "human_review_included": {
          "const": true,
          "description": "The planned range includes human review and gate effort."
        },
        "expected_checkpoints": {
          "type": "integer",
          "minimum": 0,
          "description": "Optional. Planned count of human-confirmation checkpoints, one unit per distinct human round-trip reply, over the same tiering-go-ahead-to-merge boundary the actuals record's checkpoint_count uses. This is the PLAN side of the only checkpoint pair that has both sides recorded: the actual side is checkpoint_count in sdd/{change}/actuals. Before 2026-10-22 sdd-time-estimation persisted it into sdd/{change}/estimate and called it the real calendar-time driver for agent-orchestrated delivery, which is why omitting it here made a producer that carried the field fail the closed estimate object outright; the contract now carries it on its own. Optional, not required: contracts written before this property existed stay valid, which is why adding it is a backwards-compatible extension of the 2.1.0 vocabulary rather than a version bump. The schema constrains the SHAPE (a non-negative integer); the deterministic validator enforces the floor of 1, which shape cannot express."
        }
      }
    },
    "requested_pr_strategy": {
      "type": "string",
      "enum": ["auto", "force-single", "force-chained"],
      "description": "Caller intent before review-budget normalization."
    },
    "delivery_strategy": {
      "type": "string",
      "enum": ["single-pr", "auto-chain", "exception-ok"],
      "description": "Resolved delivery strategy forwarded to implementation and review."
    },
    "chaining_required": {
      "type": "boolean"
    },
    "chain_strategy": {
      "type": "string",
      "enum": ["none", "feature-branch-chain", "stacked-to-main"],
      "description": "Concrete topology when chaining is required; none otherwise. This token domain is shared with the SDD phase skills that consume it: skills/sdd-tasks/SKILL.md records it in the tasks artifact, skills/sdd-apply/SKILL.md branches on it for PR targeting, and skills/_shared/sdd-orchestrator-workflow.md defines it. A token no consumer implements would fall through every branch unguarded, so this enum must name exactly what they branch on."
    },
    "review_budget": {
      "type": "object",
      "additionalProperties": false,
      "required": [
        "max_changed_lines_per_slice",
        "counting_method",
        "size_exception"
      ],
      "properties": {
        "max_changed_lines_per_slice": {
          "type": "integer",
          "minimum": 1
        },
        "counting_method": {
          "const": "authored-additions-and-deletions"
        },
        "size_exception": {
          "type": "object",
          "additionalProperties": false,
          "required": ["state"],
          "description": "Planning-time and delivery-time record of a per-slice budget overrun. The object stays closed: the companion fields of every state are enumerated here and unknown keys are rejected. Which companions each state requires is a cross-field invariant enforced by the deterministic validator, not by a schema conditional.",
          "properties": {
            "state": {
              "type": "string",
              "enum": ["not-needed", "approved", "granted"],
              "description": "The states divide into two kinds, and the division is the point. not-needed and approved are PRE-START PLANNING states: both are asserted before any code is written, and both are claims about the plan. not-needed asserts every planned slice is within budget; approved asserts a slice was planned over budget and that overrun was authorized up front, and so requires reason and approved_by naming who authorized it and why. granted is a DELIVERY-TIME RECORD, not a claim about the plan: it reports that a slice actually landed over budget, which is a fact about what was written that planned line counts could not have predicted, and so requires scope, changed_lines, authorized_by, and reason. This is why granted is legal precisely when the plan was within budget: it does not contradict the plan, it records what delivery revealed. MODELLING LIMIT: state holds one value, so a change that was planned over budget with an approved exception AND then overran again at delivery cannot record both facts; the delivery-time overrun would displace the planning-time authorization. That is an accepted limit of this shape, recorded here so it is not rediscovered as a surprise."
            },
            "reason": {
              "type": "string",
              "minLength": 1
            },
            "approved_by": {
              "type": "string",
              "minLength": 1
            },
            "scope": {
              "type": "string",
              "minLength": 1,
              "description": "The artifact or area whose delivery-time overrun is recorded."
            },
            "changed_lines": {
              "type": "integer",
              "minimum": 1,
              "description": "Authored additions and deletions actually landed in the over-budget scope."
            },
            "authorized_by": {
              "type": "string",
              "minLength": 1
            }
          }
        }
      }
    },
    "strict_tdd": {
      "type": "object",
      "additionalProperties": false,
      "required": ["enabled", "test_commands"],
      "properties": {
        "enabled": {
          "type": "boolean"
        },
        "test_commands": {
          "type": "object",
          "additionalProperties": false,
          "required": ["focused", "broad"],
          "properties": {
            "focused": { "$ref": "#/$defs/command_list" },
            "broad": { "$ref": "#/$defs/command_list" }
          }
        }
      }
    },
    "review_slices": {
      "type": "array",
      "minItems": 1,
      "items": {
        "type": "object",
        "additionalProperties": false,
        "required": [
          "order",
          "id",
          "title",
          "requirements",
          "dependencies",
          "estimated_changed_lines"
        ],
        "properties": {
          "order": {
            "type": "integer",
            "minimum": 1
          },
          "id": {
            "type": "string",
            "pattern": "^[a-z0-9]+(?:-[a-z0-9]+)*$"
          },
          "title": {
            "type": "string",
            "minLength": 1
          },
          "requirements": {
            "type": "array",
            "minItems": 1,
            "uniqueItems": true,
            "items": {
              "type": "string",
              "pattern": "^R-[0-9]{3,}$"
            }
          },
          "dependencies": {
            "type": "array",
            "uniqueItems": true,
            "items": {
              "type": "string",
              "pattern": "^[a-z0-9]+(?:-[a-z0-9]+)*$"
            }
          },
          "estimated_changed_lines": { "$ref": "#/$defs/nonnegative_integer_range" }
        }
      }
    },
    "expected_native_next_recommendation": {
      "type": "string",
      "enum": ["sdd-new", "select-change", "propose", "spec", "design", "tasks", "apply", "verify", "remediate", "review", "resolve-review", "archive"],
      "description": "Expected nextRecommended value from the native dispatcher immediately after the validated handoff is persisted."
    }
  },
  "$defs": {
    "artifact_ref": {
      "type": "object",
      "additionalProperties": false,
      "required": ["topic_key"],
      "properties": {
        "topic_key": {
          "type": "string",
          "minLength": 1
        },
        "openspec_path": {
          "type": "string",
          "pattern": "^openspec/",
          "description": "Normalized repository-relative path. Omit unless the artifact really exists in OpenSpec."
        }
      }
    },
    "nonnegative_number_range": {
      "type": "object",
      "additionalProperties": false,
      "required": ["low", "high"],
      "properties": {
        "low": { "type": "number", "minimum": 0 },
        "high": { "type": "number", "minimum": 0 }
      }
    },
    "nonnegative_integer_range": {
      "type": "object",
      "additionalProperties": false,
      "required": ["low", "high"],
      "properties": {
        "low": { "type": "integer", "minimum": 0 },
        "high": { "type": "integer", "minimum": 0 }
      }
    },
    "command_list": {
      "type": "array",
      "minItems": 1,
      "items": {
        "type": "string",
        "minLength": 1
      }
    }
  }
}
