{
  "contract_version": "2.1.0",
  "change_name": "longterm-mem-sync-triggers",
  "project": "labdrian-sdd-overlay",
  "tier": 2,
  "interaction_mode": "auto",
  "artifact_store_mode": "hybrid",
  "artifact_refs": {
    "entry": {
      "topic_key": "sdd/longterm-mem-sync-triggers/entry",
      "openspec_path": "openspec/changes/longterm-mem-sync-triggers/entry.json"
    },
    "requirements": {
      "topic_key": "project/labdrian-sdd-overlay/requirements/longterm-mem-sync-triggers"
    },
    "manifest": {
      "context": {
        "topic_key": "project/labdrian-sdd-overlay/manifest/context"
      },
      "mission": {
        "topic_key": "project/labdrian-sdd-overlay/manifest/mission"
      },
      "rules": {
        "topic_key": "project/labdrian-sdd-overlay/manifest/rules"
      }
    },
    "architecture": {
      "topic_key": "project/labdrian-sdd-overlay/architect/final"
    },
    "roadmap": {
      "topic_key": "project/labdrian-sdd-overlay/roadmap"
    },
    "estimate": {
      "topic_key": "sdd/longterm-mem-sync-triggers/estimate"
    },
    "sdd_init": {
      "topic_key": "sdd-init/labdrian-sdd-overlay"
    },
    "pipeline_state": {
      "topic_key": "sdd/longterm-mem-sync-triggers/pipeline-state"
    },
    "delivery": {
      "topic_key": "delivery/longterm-mem-sync-triggers"
    }
  },
  "estimate": {
    "planned_range_hours": {
      "low": 0.8,
      "high": 3.0
    },
    "complexity": "medium",
    "confidence": "low",
    "human_review_included": true,
    "expected_checkpoints": 5
  },
  "requested_pr_strategy": "auto",
  "delivery_strategy": "auto-chain",
  "chaining_required": true,
  "chain_strategy": "stacked-to-main",
  "review_budget": {
    "max_changed_lines_per_slice": 400,
    "counting_method": "authored-additions-and-deletions",
    "size_exception": {
      "state": "not-needed"
    }
  },
  "strict_tdd": {
    "enabled": true,
    "test_commands": {
      "focused": [
        "cd engine && go test ./settings/... ./cmd/...",
        "cd longterm-mem && go test ./cmd/..."
      ],
      "broad": [
        "cd engine && go vet ./... && go test ./...",
        "cd longterm-mem && go vet ./... && go test ./...",
        "shellcheck -S warning bin/labdrian-overlay"
      ]
    }
  },
  "review_slices": [
    {
      "order": 1,
      "id": "sync-runner",
      "title": "Zero-dependency engine sync-trigger verb: detached child, bounded timeout, exit-code classification, always exit 0, log file",
      "requirements": [
        "R-003"
      ],
      "dependencies": [],
      "estimated_changed_lines": {
        "low": 270,
        "high": 380
      }
    },
    {
      "order": 2,
      "id": "session-end-hook",
      "title": "SessionEnd hook family in engine/settings, status-hooks check, runtime partial message, install/uninstall wording",
      "requirements": [
        "R-002",
        "R-003"
      ],
      "dependencies": [
        "sync-runner"
      ],
      "estimated_changed_lines": {
        "low": 200,
        "high": 320
      }
    },
    {
      "order": 3,
      "id": "archive-trigger",
      "title": "labdrian longterm-mem sync-trigger wrapper and the closure-feedback archive call site",
      "requirements": [
        "R-001",
        "R-003"
      ],
      "dependencies": [
        "session-end-hook"
      ],
      "estimated_changed_lines": {
        "low": 80,
        "high": 200
      }
    }
  ],
  "expected_native_next_recommendation": "propose"
}
